{
  "report_id": "DR-2026-09-15",
  "project_id": "RS-DEMO-001",
  "date": "2026-09-15",
  "weather": {
    "condition": "صبح صاف و بعدازظهر گرم",
    "workable_hours": 9,
    "source": "مشاهدهٔ میدانی"
  },
  "work_fronts": [
    {
      "front": "عملیات خاکی شمال",
      "location": "CH 6+000–8+400",
      "wbs_id": "WBS-02",
      "work": "اجرای خاکریز و تراکم",
      "status": "active"
    },
    {
      "front": "زهکشی جنوب",
      "location": "CH 3+200–3+650",
      "wbs_id": "WBS-03",
      "work": "نصب آبرو و آماده‌سازی دیوار سرآب",
      "status": "active"
    }
  ],
  "resources": {
    "labour_count": 48,
    "equipment": [
      "EXC-02",
      "GRD-01",
      "ROL-03",
      "TRK-07"
    ],
    "materials": [
      "خاک منتخب",
      "آرماتور",
      "بتن"
    ]
  },
  "quantities": [
    {
      "wbs_id": "WBS-02",
      "boq_item": "EARTH-EXC-001",
      "quantity": 4200,
      "unit": "m3",
      "status": "measured"
    },
    {
      "wbs_id": "WBS-03",
      "boq_item": "DRAIN-CUL-001",
      "quantity": 2,
      "unit": "ea",
      "status": "measured"
    }
  ],
  "quality": [
    {
      "inspection_id": "ITP-003",
      "status": "witness_requested",
      "result": "pending",
      "evidence_ref": "FIELD-PHOTO-2026-09-15"
    }
  ],
  "hse": {
    "toolbox_talk": true,
    "observations": 3,
    "incidents": 0,
    "traffic_setup": "checked",
    "environmental_observation": "کنترل گردوغبار فعال است"
  },
  "blockers": [
    {
      "blocker_id": "BLK-001",
      "description": "تأیید تأسیسات در CH 8+200",
      "owner": "مسئول تأسیسات",
      "due_date": "2026-09-25",
      "status": "open"
    }
  ],
  "evidence": [
    {
      "type": "photo-set",
      "ref": "FIELD-PHOTO-2026-09-15"
    },
    {
      "type": "survey",
      "ref": "SUR-2026-09-15"
    }
  ],
  "classification": "fictional-example"
}
